product name,color,description,url,time,price,currency,size,region,category
Jungle Print Crêpe de Chine Silk Shirt,print,"Crafted from delicate silk Crêpe de Chine, this button up shirt is an elegant office to happy hour piece. The style features the Jungle prin",https://www.versace.com/us/en-us/women/clothing/blouses-tops/jungle-print-cr%C3%AApe-de-chine-silk-shirt-a7010/A82662-A234699_A7010.html?cgid=120200,2020-04-05 19:43:23.771731,"$1,125",USD,"38,40,42,44",us,"women,clothing,blouses-tops"
V-Pattern Lace Top,"black,pink","Stylish, yet understated, this short sleeved top is crafted from delicate V-pattern lace.",https://www.versace.com/us/en-us/women/clothing/blouses-tops/v-pattern-lace-top-a1708/A85558-A233113_A1708.html?cgid=120200,2020-04-05 19:43:23.786371,$650,USD,"40,42,44",us,"women,clothing,blouses-tops"
V Barocco Print Puffer Coat,print,This padded puffer coat is enriched with a statement high neckline and diagonal zip closure. The accent outerwear piece boasts the V Barocco,https://www.versace.com/us/en-us/women/clothing/jackets-coats/v-barocco-print-puffer-coat-a7900/A85817-A233315_A7900.html?cgid=120700,2020-04-05 19:43:23.965736,"$2,350",USD,"36,38,40,42,44",us,"women,clothing,jackets-coats"
Barocco Signature Print Bomber Jacket,print,"Silk bomber jacket in the Barocco Signature print, featuring an all-over motif of Gianni Versace's handwriting fused with gold tone Medusa,",https://www.versace.com/us/en-us/women/clothing/jackets-coats/barocco-signature-print-bomber-jacket-a7900/A85811-A232981_A7900.html?cgid=120700,2020-04-05 19:43:23.979813,"$2,725",USD,"38,40,46",us,"women,clothing,jackets-coats"
Medusa Button Puffer Jacket,"black,Orange",This warm puffer hooded jacket is enriched with gold-tone Medusa buttons along the front closure. The casual piece features a hidden house c,https://www.versace.com/us/en-us/women/clothing/jackets-coats/medusa-button-puffer-jacket-a1200/A85474-A223395_A1200.html?cgid=120700,2020-04-05 19:43:23.999372,"$1,975",USD,"36,38,40,42,44",us,"women,clothing,jackets-coats"
Graphic Neckline Bustier Top,black,The graphic neckline of this bustier top is inspired by the House's rich sartorial heritage. This viscose cady style can be worn alone for a,https://www.versace.com/us/en-us/women/clothing/blouses-tops/graphic-neckline-bustier-top-a1008/A86283-A213159_A1008.html?cgid=120200,2020-04-05 19:43:24.033314,"$1,125",USD,"38,40,42,44",us,"women,clothing,blouses-tops"
Heritage Neckline Bustier Top,black,"A runway style, this strapless bustier boasts a deep heritage neckline. This neoprene top is equally impressive when worn alone or layered o",https://www.versace.com/us/en-us/women/clothing/blouses-tops/heritage-neckline-bustier-top-a1008/A86281-A234369_A1008.html?cgid=120200,2020-04-05 19:43:24.046723,"$1,125",USD,"38,40,42,44",us,"women,clothing,blouses-tops"
Asymmetric Silk Crêpe De Chine Top,black,"Crafted from Crêpe De Chine, this asymmetric top is a statement piece in an array of day and evening looks. This elegant style is embellishe",https://www.versace.com/us/en-us/women/clothing/blouses-tops/asymmetric-silk-cr%C3%AApe-de-chine-top-a1008/A86631-A216477_A1008.html?cgid=120200,2020-04-05 19:43:24.060016,$850,USD,"38,40,42,44",us,"women,clothing,blouses-tops"
Sculptural Shoulder Short Crêpe Top,black,"A runway style, this statement top is crafted from viscose crêpe and features exaggerated shoulders and draped sleeves.",https://www.versace.com/us/en-us/women/clothing/blouses-tops/sculptural-shoulder-short-cr%C3%AApe-top-a1008/A86386-A208595_A1008.html?cgid=120200,2020-04-05 19:43:24.101829,"$1,225",USD,"36,38,40,42,44,46",us,"women,clothing,blouses-tops"
Geometric Neckline Bustier Top,black,"Seen on the Spring-Summer 2020 runway, this bustier top features a heritage geometric neckline. This viscose cady style can be worn alone or",https://www.versace.com/us/en-us/women/clothing/blouses-tops/geometric-neckline-bustier-top-a1008/A86566-A222813_A1008.html?cgid=120200,2020-04-05 19:43:24.119524,$725,USD,"38,40,42,44",us,"women,clothing,blouses-tops"
Safety Pin Nappa Leather Jacket,black,"Crafted in supple nappa leather, this biker jacket features diagonal zip closure, front zip pockets and a flap-over pocket enriched with a M",https://www.versace.com/us/en-us/women/clothing/jackets-coats/safety-pin-nappa-leather-jacket-a1008/A85480-A233389_A1008.html?cgid=120700,2020-04-05 19:43:24.185024,"$2,950",USD,"38,42",us,"women,clothing,jackets-coats"
Embroidered Medusa Bomber Jacket,black,"Crafted in duchesse, this bomber jacket features front zip closure and gold-tone ribbed knits. The casual jacket is enriched with an embroid",https://www.versace.com/us/en-us/women/clothing/jackets-coats/embroidered-medusa-bomber-jacket-a1008/A86073-A224455_A1008.html?cgid=120700,2020-04-05 19:43:24.197341,"$2,295",USD,"36,38,40,44,46",us,"women,clothing,jackets-coats"
Studded Denim Jacket,blue,"Crafted in stretch denim, this oversized denim jacket is enriched with all-over detailed studwork - including a studded Gianni Versace signa",https://www.versace.com/us/en-us/women/clothing/jackets-coats/studded-denim-jacket-a8053/A85716-A232843_A8053.html?cgid=120700,2020-04-05 19:43:24.211259,"$2,925",USD,"38,42,44",us,"women,clothing,jackets-coats"
Barocco Signature Print Denim Jacket,print,"Crafted from stretch denim in the Barocco Signature print, this denim jacket is enriched with gold-tone Medusa buttons. The all-over design",https://www.versace.com/us/en-us/women/clothing/jackets-coats/barocco-signature-print-denim-jacket-a7004/A85459-A233242_A7004.html?cgid=120700,2020-04-05 19:43:24.253709,"$1,375",USD,"38,42,44",us,"women,clothing,jackets-coats"
Signature Denim Jacket,blue,"This stonewashed denim jacket encompasses the brand DNA: the closure is enriched with heritage Medusa buttons, darker denim detail outlines",https://www.versace.com/us/en-us/women/clothing/jackets-coats/signature-denim-jacket-a8004/A85673-A232771_A8004.html?cgid=120700,2020-04-05 19:43:24.267616,"$1,125",USD,"38,40,42",us,"women,clothing,jackets-coats"
Stud Medusa Slim Fit T-Shirt,"white,black","Crafted from organic cotton, this stretch slim fit t-shirt is enriched with Medusa-shaped studwork.",https://www.versace.com/us/en-us/women/clothing/t-shirts-sweatshirts/stud-medusa-slim-fit-t-shirt-a1008/A82241-A232123_A1008.html?cgid=120302,2020-04-05 19:43:24.283072,$775,USD,"36,38,40,42,44,46,48,50",us,"women,clothing,t-shirts-sweatshirts"
Tie-Dye Denim Jacket,print,"Crafted from stretch cotton, this oversized denim jacket features a tie-dye effect inspired by colors of the desert sky. The casual staple i",https://www.versace.com/us/en-us/women/clothing/jackets-coats/tie-dye-denim-jacket-a8114/A85683-A228455_A8114.html?cgid=120700,2020-04-05 19:43:24.299525,"$1,550",USD,"36,38,40",us,"women,clothing,jackets-coats"
Medusa Signature Motif Slim Fit T-Shirt,white+print,"Crafted in pure organic cotton, this crew neck, short sleeve t-shirt is embellished with a metallic Medusa logo print and a motif of Gianni",https://www.versace.com/us/en-us/women/clothing/t-shirts-sweatshirts/medusa-signature-motif-slim-fit-t-shirt-a3272/A85760-A228806_A3272.html?cgid=120302,2020-04-05 19:43:24.317541,$325,USD,"36,38,40,42,44,46,48",us,"women,clothing,t-shirts-sweatshirts"
Embroidered Western Motif T-Shirt,white,Organic cotton t-shirt embroidered with a design depicting a camp take on Western folklore.,https://www.versace.com/us/en-us/women/clothing/t-shirts-sweatshirts/embroidered-western-motif-t-shirt-a1001/A85766-A228806_A1001.html?cgid=120302,2020-04-05 19:43:24.443147,"$1,225",USD,"38,40,42,44",us,"women,clothing,t-shirts-sweatshirts"
Logo T-Shirt,pink+gold,"Crafted in pure organic cotton, this t-shirt features the Versace logo embroidered with details inspired by the American West.",https://www.versace.com/us/en-us/women/clothing/t-shirts-sweatshirts/logo-t-shirt-a1247/A85762-A228806_A1247.html?cgid=120302,2020-04-05 19:43:24.457653,$775,USD,"36,38,40,42,44,46,48",us,"women,clothing,t-shirts-sweatshirts"
Crystal GV Signature T-Shirt,black,"Crafted from pure organic cotton, this t-shirt features a crew neck and short sleeves. This wardrobe staple is enriched with a reintroduced",https://www.versace.com/us/en-us/women/clothing/t-shirts-sweatshirts/crystal-gv-signature-t-shirt-a1008/A85751-A228806_A1008.html?cgid=120302,2020-04-05 19:43:24.474496,$425,USD,"36,38,40,42,44,46,48",us,"women,clothing,t-shirts-sweatshirts"
Embroidered GV Signature T-Shirt,"pink,black,white+black",A wardrobe staple - this organic cotton t-shirt features a motif of Gianni Versace's signature.,https://www.versace.com/us/en-us/women/clothing/t-shirts-sweatshirts/embroidered-gv-signature-t-shirt-a2242/A85757-A228806_A2242.html?cgid=120302,2020-04-05 19:43:24.493936,$350,USD,"36,38,40,42,44,46,48,50",us,"women,clothing,t-shirts-sweatshirts"
Mixed Print T-Shirt,print,"Crafted in pure organic cotton, this crew neck, short sleeve t-shirt features a mix of seasonal prints.",https://www.versace.com/us/en-us/women/clothing/t-shirts-sweatshirts/mixed-print-t-shirt-a7205/A85768-A233369_A7205.html?cgid=120302,2020-04-05 19:43:24.510865,$625,USD,"36,38,40,42,44,46",us,"women,clothing,t-shirts-sweatshirts"
Embroidered GV Signature T-Shirt,"pink,black,white+black",A wardrobe staple - this organic cotton t-shirt features a motif of Gianni Versace's signature.,https://www.versace.com/us/en-us/women/clothing/t-shirts-sweatshirts/embroidered-gv-signature-t-shirt-a2048/A85757-A228806_A2048.html?cgid=120302,2020-04-05 19:43:24.531035,$350,USD,"36,38,40,42,44,46,48,50",us,"women,clothing,t-shirts-sweatshirts"
Embroidered Jungle Medusa T-Shirt,white,"Crafted from pure organic cotton, this t-shirt is embroidered with a classic Medusa motif juxtaposed with elements from the iconic Jungle de",https://www.versace.com/us/en-us/women/clothing/t-shirts-sweatshirts/embroidered-jungle-medusa-t-shirt-a1001/A86635-A228806_A1001.html?cgid=120302,2020-04-05 19:43:24.551649,"$1,425",USD,"36,38,40,42",us,"women,clothing,t-shirts-sweatshirts"
Medusa Logo T-Shirt,white,"Crafted from pure organic cotton, this oversized fit t-shirt is embroidered with a classic Medusa motif in bright colors.",https://www.versace.com/us/en-us/women/clothing/t-shirts-sweatshirts/medusa-logo-t-shirt-a1001/A86871-A228806_A1001.html?cgid=120302,2020-04-05 19:43:24.567807,$595,USD,"36,38,40,42,44,46,48",us,"women,clothing,t-shirts-sweatshirts"
Embroidered GV Signature T-Shirt,"pink,black,white+black",A wardrobe staple - this organic cotton t-shirt features a motif of Gianni Versace's signature.,https://www.versace.com/us/en-us/women/clothing/t-shirts-sweatshirts/embroidered-gv-signature-t-shirt-a2024/A85757-A228806_A2024.html?cgid=120302,2020-04-05 19:43:24.709924,$350,USD,"36,38,40,42,44,46,48",us,"women,clothing,t-shirts-sweatshirts"
Embroidered GV Signature T-Shirt,black,"Crafted in pure cotton jersey, this casual t-shirt is embellished by an embroidered signature of Gianni Versace.",https://www.versace.com/us/en-us/women/clothing/t-shirts-sweatshirts/embroidered-gv-signature-t-shirt-a2024/A86600-A234565_A2024.html?cgid=120302,2020-04-05 19:43:24.723835,$350,USD,"36,38,40,42,44,46,48",us,"women,clothing,t-shirts-sweatshirts"
Embroidered GV Signature Sweatshirt,black,"An everyday staple, this knit cotton sweater features a crew neck, long sleeves and ribbed knits. The sweater is embellished by a newly rein",https://www.versace.com/us/en-us/women/clothing/t-shirts-sweatshirts/embroidered-gv-signature-sweatshirt-a1008/A85556-A233106_A1008.html?cgid=120302,2020-04-05 19:43:24.735977,$495,USD,"36,38,40,42,44,46,48",us,"women,clothing,t-shirts-sweatshirts"
Embroidered GV Signature Sweatshirt,"white,pink","This soft, casual sweatshirt is crafted from pure organic cotton and features a motif of Gianni Versace's handwritten signature.",https://www.versace.com/us/en-us/women/clothing/t-shirts-sweatshirts/embroidered-gv-signature-sweatshirt-a1001/A85854-A231242_A1001.html?cgid=120302,2020-04-05 19:43:24.749717,$550,USD,"36,38,40,42,44,46",us,"women,clothing,t-shirts-sweatshirts"
Tie-Dye Medusa T-Shirt,"green,pink","A runway style, this cotton t-shirt features the Medusa printed over a Tie-Dye background. The asymmetric neckline and draped shoulder accen",https://www.versace.com/us/en-us/women/clothing/t-shirts-sweatshirts/tie-dye-medusa-t-shirt-a7002/A86374-A234568_A7002.html?cgid=120302,2020-04-05 19:43:24.764279,$795,USD,"36,38,40,42,44,46",us,"women,clothing,t-shirts-sweatshirts"
Tie-Dye Medusa T-Shirt,"green,pink","A runway style, this cotton t-shirt features the Medusa printed over a Tie-Dye background. The asymmetric neckline and draped shoulder accen",https://www.versace.com/us/en-us/women/clothing/t-shirts-sweatshirts/tie-dye-medusa-t-shirt-a7525/A86374-A234568_A7525.html?cgid=120302,2020-04-05 19:43:24.786166,$795,USD,"36,38,40,42,44,46,48",us,"women,clothing,t-shirts-sweatshirts"
Tie-Dye Print Medusa T-Shirt,print,"Seen on the Spring-Summer 2020 runway, this t-shirt boasts a Medusa motif printed over a Tie-Dye pattern, inspired by experimentation and in",https://www.versace.com/us/en-us/women/clothing/t-shirts-sweatshirts/tie-dye-print-medusa-t-shirt-a7870/A86601-A234717_A7870.html?cgid=120302,2020-04-05 19:43:24.802741,$495,USD,"36,38,40,42,44,46,48",us,"women,clothing,t-shirts-sweatshirts"
Tie-Dye Print Hoodie,pink,"Seen on the Spring-Summer 2020 runway, the structural shape of this hoodie is constructed with shoulder pads. The style features Gianni Vers",https://www.versace.com/us/en-us/women/clothing/t-shirts-sweatshirts/tie-dye-print-hoodie-a7002/A86629-A234708_A7002.html?cgid=120302,2020-04-05 19:43:24.818358,$975,USD,"36,38,40,42,44,46",us,"women,clothing,t-shirts-sweatshirts"
Tie-Dye Print Long Sleeve T-Shirt,"violet,pink","Crafted from light viscose jersey, this long sleeve t-shirt features an iteration of the Tie-Dye print. Seen on the runway, the design depic",https://www.versace.com/us/en-us/women/clothing/t-shirts-sweatshirts/tie-dye-print-long-sleeve-t-shirt-a7002/A86255-A234679_A7002.html?cgid=120302,2020-04-05 19:43:24.959596,$675,USD,"36,38,40,42,44,46",us,"women,clothing,t-shirts-sweatshirts"
Tie-Dye Print Sweatshirt,green,"A runway style, this sweatshirt is crafted from pure organic cotton and features a strong, oversized silhouette created with shoulder pads.",https://www.versace.com/us/en-us/women/clothing/t-shirts-sweatshirts/tie-dye-print-sweatshirt-a7525/A86353-A234708_A7525.html?cgid=120302,2020-04-05 19:43:24.973685,$995,USD,"36,38,40,42,44,46",us,"women,clothing,t-shirts-sweatshirts"
Virtus Python Shoulder Bag,"pink,green","The Virtus bag line takes its name from the Roman deity and symbolizes strength, courage, and character. Crafted in the finest quality pytho",https://www.versace.com/us/en-us/women/bags/virtus-bag/virtus-python-shoulder-bag-kvdot/DBFG985-D3PML_DTU_UNICA_KVDOT__.html?cgid=142900,2020-04-05 19:43:24.985445,"$3,350",USD,one-size,us,"women,bags,virtus-bag"
Embroidered GV Signature Sweatshirt,"white,pink","This soft, casual sweatshirt is crafted from pure organic cotton and features a motif of Gianni Versace's handwritten signature.",https://www.versace.com/us/en-us/women/clothing/t-shirts-sweatshirts/embroidered-gv-signature-sweatshirt-a1708/A85854-A231242_A1708.html?cgid=120302,2020-04-05 19:43:25.000077,$550,USD,"36,38,40,42,44,46",us,"women,clothing,t-shirts-sweatshirts"
Tie-Dye Print Long Sleeve T-Shirt,"violet,pink","Crafted from light viscose jersey, this long sleeve t-shirt features an iteration of the Tie-Dye print. Seen on the runway, the design depic",https://www.versace.com/us/en-us/women/clothing/t-shirts-sweatshirts/tie-dye-print-long-sleeve-t-shirt-a7869/A86255-A234679_A7869.html?cgid=120302,2020-04-05 19:43:25.019068,$675,USD,"36,38,40,42,44,46,48",us,"women,clothing,t-shirts-sweatshirts"
GV Signature Tie-Dye T-Shirt,print,"Crafted in pure organic cotton, this crew neck, short sleeve t-shirt features a tie-dye print inspired by colors of the desert sky. The t-sh",https://www.versace.com/us/en-us/women/clothing/t-shirts-sweatshirts/gv-signature-tie-dye-t-shirt-a7010/A85758-A233409_A7010.html?cgid=120302,2020-04-05 19:43:25.034626,$550,USD,"36,38,40,42,44,46,48,50",us,"women,clothing,t-shirts-sweatshirts"
Safety Pin GV Signature Sweatshirt,black,"Crafted in organic cotton, this casual sweatshirt features a motif of Gianni Versace's handwritten signature. The crew neck, long sleeve swe",https://www.versace.com/us/en-us/women/clothing/t-shirts-sweatshirts/safety-pin-gv-signature-sweatshirt-a1008/A85847-A231242_A1008.html?cgid=120302,2020-04-05 19:43:25.051519,$675,USD,"36,38,40,42,44,46,48",us,"women,clothing,t-shirts-sweatshirts"
Jungle Print Virtus Shoulder Bag,"print,black","The Virtus bag line takes its name from the Roman deity and symbolizes strength, courage, and character. Crafted in the finest quality calf",https://www.versace.com/us/en-us/women/bags/virtus-bag/jungle-print-virtus-shoulder-bag-dnfot/DBFG985-DVS2P_DTU_UNICA_DNFOT__.html?cgid=142900,2020-04-05 19:43:25.067386,"$2,850",USD,one-size,us,"women,bags,virtus-bag"
Large Tie-Dye Print Virtus Bucket Bag,blue,"Presented on the Spring-Summer 2020 runway, the new bucket bag style features top handles, a removable leather shoulder strap and flat inter",https://www.versace.com/us/en-us/women/bags/virtus-bag/large-tie-dye-print-virtus-bucket-bag-dbwot/DBFH488-D2VSTD_DTU_UNICA_DBWOT__.html?cgid=142900,2020-04-05 19:43:25.212301,"$2,475",USD,one-size,us,"women,bags,virtus-bag"
Large Virtus Shoulder Bag,"white,black","The new large shoulder bag style features a belt shoulder strap, front flap turn lock closure and flat internal pockets. The supple leather",https://www.versace.com/us/en-us/women/bags/virtus-bag/large-virtus-shoulder-bag-k0aot/DBFH489-D5VIT_DTU_UNICA_K0AOT__.html?cgid=142900,2020-04-05 19:43:25.225811,"$2,350",USD,one-size,us,"women,bags,virtus-bag"
Tie-Dye Print Virtus Bucket Bag,print,"Presented on the Spring-Summer 2020 runway, the new bucket bag style features top handles, a removable leather shoulder strap and flat inter",https://www.versace.com/us/en-us/women/bags/virtus-bag/tie-dye-print-virtus-bucket-bag-dbvot/DBFH470-D2VSTD_DTU_UNICA_DBVOT__.html?cgid=142900,2020-04-05 19:43:25.238209,"$2,225",USD,one-size,us,"women,bags,virtus-bag"
Large Virtus Shoulder Bag,"white,black","The new large shoulder bag style features a belt shoulder strap, front flap turn lock closure and flat internal pockets. The supple leather",https://www.versace.com/us/en-us/women/bags/virtus-bag/large-virtus-shoulder-bag-k41ot/DBFH489-D5VIT_DTU_UNICA_K41OT__.html?cgid=142900,2020-04-05 19:43:25.252790,"$2,350",USD,one-size,us,"women,bags,virtus-bag"
Virtus Evening Bag,"red,white,black,pink","Debuting on the Fall-Winter 2019 runway, the Virtus bag takes its name from the Roman deity and symbolizes strength, courage, and character.",https://www.versace.com/us/en-us/women/bags/virtus-bag/virtus-evening-bag-k0aot/DBFH209-D5VIT_DTU_UNICA_K0AOT__.html?cgid=142900,2020-04-05 19:43:25.268793,$795,USD,one-size,us,"women,bags,virtus-bag"
Jungle Embroidered Virtus Evening Bag,print,"The Virtus bag takes its name from the Roman deity and symbolizes strength, courage, and character. Crafted in supple calf leather, the even",https://www.versace.com/us/en-us/women/bags/virtus-bag/jungle-embroidered-virtus-evening-bag-dnmot/DBFH209-D2NRP_DTU_UNICA_DNMOT__.html?cgid=142900,2020-04-05 19:43:25.284044,"$1,495",USD,one-size,us,"women,bags,virtus-bag"
Virtus Embellished Evening Bag,"white,pink,black","Crafted from leather and embellished with shimmering crystals, the Virtus evening bag features a magnetic flap-over closure, a shoulder chai",https://www.versace.com/us/en-us/women/bags/virtus-bag/virtus-embellished-evening-bag-k41ot/DBFH209-D2RASS_DTU_UNICA_K41OT__.html?cgid=142900,2020-04-05 19:43:25.309710,"$1,150",USD,one-size,us,"women,bags,virtus-bag"
Tie-Dye Print Virtus Shoulder Bag,pink,"The Virtus bag line takes its name from the Roman deity and symbolizes strength, courage, and character. Crafted in the finest quality calf",https://www.versace.com/us/en-us/women/bags/virtus-bag/tie-dye-print-virtus-shoulder-bag-dbft/DBFG985-D2VSTD_DTU_UNICA_DBFT__.html?cgid=142900,2020-04-05 19:43:25.322321,"$2,325",USD,one-size,us,"women,bags,virtus-bag"
Jungle Print Virtus Shoulder Bag,"print,black","The Virtus bag line takes its name from the Roman deity and symbolizes strength, courage, and character. Crafted in the finest quality calf",https://www.versace.com/us/en-us/women/bags/virtus-bag/jungle-print-virtus-shoulder-bag-dbvot/DBFG985-DVS2P_DTU_UNICA_DBVOT__.html?cgid=142900,2020-04-05 19:43:25.409649,"$2,850",USD,one-size,us,"women,bags,virtus-bag"
Quilted Virtus Evening Bag,"blue,pink,black,orange,white,pink","Debuting on the Fall-Winter 2019 runway, the Virtus bag takes its name from the Roman deity and symbolizes strength, courage, and character.",https://www.versace.com/us/en-us/women/bags/virtus-bag/quilted-virtus-evening-bag-k6bot/DBFH209-DNATR4_DTU_UNICA_K6BOT__.html?cgid=142900,2020-04-05 19:43:25.470676,$895,USD,one-size,us,"women,bags,virtus-bag"
Quilted Virtus Shoulder Bag,"pink,white,orange,black,pink","Debuting on the Fall-Winter 2019 runway, the Virtus bag takes its name from the Roman deity and symbolizes strength, courage, and character.",https://www.versace.com/us/en-us/women/bags/virtus-bag/quilted-virtus-shoulder-bag-k6bot/DBFG985-DNATR4_DTU_UNICA_K6BOT__.html?cgid=142900,2020-04-05 19:43:25.485867,"$1,975",USD,one-size,us,"women,bags,virtus-bag"
Virtus Clutch,"black,white","Taking its name from the Roman deity that symbolizes strength, courage, and character, the new Virtus clutch bag is crafted in exceptional q",https://www.versace.com/us/en-us/women/bags/virtus-bag/virtus-clutch-k41ot/DBSH322-D5VIT_DTU_UNICA_K41OT__.html?cgid=142900,2020-04-05 19:43:25.502127,"$1,425",USD,one-size,us,"women,bags,virtus-bag"
Virtus Camera Bag,"white,black","Taking its name from the Roman deity that symbolizes strength, courage, and character, the new Virtus camera bag is crafted in exceptional q",https://www.versace.com/us/en-us/women/bags/virtus-bag/virtus-camera-bag-k41ot/DBFH312-D5VIT_DTU_UNICA_K41OT__.html?cgid=142900,2020-04-05 19:43:25.514093,"$1,225",USD,one-size,us,"women,bags,virtus-bag"
Jungle Print Virtus Top Handle Bag,print,"The Virtus bag takes its name from the Roman deity and symbolizes strength, courage, and character. Crafted from supple leather in the Jungl",https://www.versace.com/us/en-us/women/bags/virtus-bag/jungle-print-virtus-top-handle-bag-dbvot/DBFH006-DVS2P_DTU_UNICA_DBVOT__.html?cgid=142900,2020-04-05 19:43:25.549078,"$3,625",USD,one-size,us,"women,bags,virtus-bag"
Large Virtus Bucket Bag,"black,white","Presented on the Spring-Summer 2020 runway, the new bucket bag style features top handles, a removable leather shoulder strap and flat inter",https://www.versace.com/us/en-us/women/bags/virtus-bag/large-virtus-bucket-bag-k0aot/DBFH488-D5VIT_DTU_UNICA_K0AOT__.html?cgid=142900,2020-04-05 19:43:25.561420,"$2,225",USD,one-size,us,"women,bags,virtus-bag"
Jungle Print Virtus Mini Chain Wallet,print,"Crafted from supple leather in the iconic Jungle print, this wallet is embellished with emblematic Barocco V hardware - a bold symbol of the",https://www.versace.com/us/en-us/women/bags/virtus-bag/jungle-print-virtus-mini-chain-wallet-kvemt/DP3H538V-D3VSTP_DTU_UNICA_KVEMT__.html?cgid=142900,2020-04-05 19:43:25.646372,$675,USD,one-size,us,"women,bags,virtus-bag"
Large Virtus Bucket Bag,"black,white","Presented on the Spring-Summer 2020 runway, the new bucket bag style features top handles, a removable leather shoulder strap and flat inter",https://www.versace.com/us/en-us/women/bags/virtus-bag/large-virtus-bucket-bag-k41ot/DBFH488-D5VIT_DTU_UNICA_K41OT__.html?cgid=142900,2020-04-05 19:43:25.659621,"$2,225",USD,one-size,us,"women,bags,virtus-bag"
Virtus Bucket Bag,"black,white","Presented on the Spring-Summer 2020 runway, the new bucket bag style features top handles, a removable leather shoulder strap and flat inter",https://www.versace.com/us/en-us/women/bags/virtus-bag/virtus-bucket-bag-k0aot/DBFH523-D5VIT_DTU_UNICA_K0AOT__.html?cgid=142900,2020-04-05 19:43:25.697263,"$1,725",USD,one-size,us,"women,bags,virtus-bag"
Quilted Virtus Shoulder Bag,"pink,white,orange,black,pink","Debuting on the Fall-Winter 2019 runway, the Virtus bag takes its name from the Roman deity and symbolizes strength, courage, and character.",https://www.versace.com/us/en-us/women/bags/virtus-bag/quilted-virtus-shoulder-bag-k41ot/DBFG985-DNATR4_DTU_UNICA_K41OT__.html?cgid=142900,2020-04-05 19:43:25.713787,"$1,975",USD,one-size,us,"women,bags,virtus-bag"
La Coupe Des Dieux Print Beach Bag,print,Elegant beach bag in the La Coupe des Dieux print. This bag features a draw-string closure and adjustable shoulder straps.,https://www.versace.com/us/en-us/women/clothing/swimwear/la-coupe-des-dieux-print-beach-bag-z7624/ZBAG00001-ZCOSP094_Z01_UNIC_Z7624__.html?cgid=122000,2020-04-05 19:43:25.726714,$775,USD,one-size,us,"women,clothing,swimwear"
Quilted Virtus Evening Bag,"blue,pink,black,orange,white,pink","Debuting on the Fall-Winter 2019 runway, the Virtus bag takes its name from the Roman deity and symbolizes strength, courage, and character.",https://www.versace.com/us/en-us/women/bags/virtus-bag/quilted-virtus-evening-bag-k41ot/DBFH209-DNATR4_DTU_UNICA_K41OT__.html?cgid=142900,2020-04-05 19:43:25.750625,$895,USD,one-size,us,"women,bags,virtus-bag"
Quilted Virtus Evening Bag,"blue,pink,black,orange,white,pink","Debuting on the Fall-Winter 2019 runway, the Virtus bag takes its name from the Roman deity and symbolizes strength, courage, and character.",https://www.versace.com/us/en-us/women/bags/virtus-bag/quilted-virtus-evening-bag-k0aot/DBFH209-DNATR4_DTU_UNICA_K0AOT__.html?cgid=142900,2020-04-05 19:43:25.764718,$895,USD,one-size,us,"women,bags,virtus-bag"
