product name,color,description,url,time,price,currency,size,region,category
Tie-Dye Print Chain Reaction 2 Sneakers,pink,"Featuring the Tie-Dye print, these Chain Reaction 2 sneakers embody the strongest elements of the Versace identity. Eclectic details create",https://www.versace.com/us/en-us/women/shoes/chain-reaction-sneakers/tie-dye-print-chain-reaction-2-sneakers-dbf/DST030G-D23V_DBF.html?cgid=100700,2020-04-05 19:43:18.666042,"$1,325",USD,"36,36.5,37,37.5,38,38.5,39,40,41",us,"women,shoes,chain-reaction-sneakers"
Chain Reaction Sneakers,"pink,black","The Chain Reaction, a sneaker that embodies the strongest elements of the Versace identity. Eclectic details create a one-of-a-kind shoe cha",https://www.versace.com/us/en-us/women/shoes/chain-reaction-sneakers/chain-reaction-sneakers-k9r/DSR705G-D36TG_K9R.html?cgid=100700,2020-04-05 19:43:18.693518,$995,USD,"36,36.5,37,37.5,38,38.5,39,39.5,40,41",us,"women,shoes,chain-reaction-sneakers"
Chain Reaction 2 Sneakers,print,"The Chain Reaction, a sneaker that embodies the strongest elements of the Versace identity. Eclectic details create a one-of-a-kind shoe cha",https://www.versace.com/us/en-us/women/shoes/chain-reaction-sneakers/chain-reaction-2-sneakers-dnob/DST030G-D41TG_DNOB.html?cgid=100700,2020-04-05 19:43:18.732825,$995,USD,"36,37,37.5,38,38.5,39,39.5,40,41",us,"women,shoes,chain-reaction-sneakers"
Green Python Icon Mini Shoulder Bag,green,"Crafted in luxurious python, the iconic Versace bag, is a timeless style. The shoulder bag has been revisited in a new, mini size, featuring",https://www.versace.com/us/en-us/women/bags/shoulder-bags/green-python-icon-mini-shoulder-bag-kvdot/DP3H581-D3PML_DTU_UNICA_KVDOT__.html?cgid=142200,2020-04-05 19:43:18.749759,"$1,075",USD,one-size,us,"women,bags,shoulder-bags"
Chain Reaction Sneakers,print,"The Chain Reaction, a sneaker that embodies the strongest elements of the Versace identity. Eclectic details create a one-of-a-kind shoe cha",https://www.versace.com/us/en-us/women/shoes/chain-reaction-sneakers/chain-reaction-sneakers-dwnr/DSR705G-DECTG_DWNR.html?cgid=100700,2020-04-05 19:43:18.766130,"$1,475",USD,"36,36.5,37,37.5,38,38.5,39,40,41",us,"women,shoes,chain-reaction-sneakers"
Chain Reaction Sneakers,"pink,black","The Chain Reaction, a sneaker that embodies the strongest elements of the Versace identity. Eclectic details create a one-of-a-kind shoe cha",https://www.versace.com/us/en-us/women/shoes/chain-reaction-sneakers/chain-reaction-sneakers-d41/DSR705G-D36TG_D41.html?cgid=100700,2020-04-05 19:43:18.809691,$995,USD,"36,36.5,37,37.5,38,38.5,39,40,41",us,"women,shoes,chain-reaction-sneakers"
Barocco Print Chain Reaction 2 Sneakers,white+print,"The Chain Reaction 2, sneakers that embody the strongest elements of the Versace identity. Eclectic details create a one-of-a-kind shoe char",https://www.versace.com/us/en-us/women/shoes/chain-reaction-sneakers/barocco-print-chain-reaction-2-sneakers-dbn9/DST030G-DT21_DBN9.html?cgid=100700,2020-04-05 19:43:18.843364,"$1,075",USD,"35,35.5,36,36.5,37,37.5,38,38.5,39,39.5,40,40.5,41",us,"women,shoes,chain-reaction-sneakers"
Red Mini Icon Python Shoulder Bag,red,"Crafted in luxurous python, the iconic Versace bag, is a timeless style. The shoulder bag has been revisited in a new, mini size, featuring",https://www.versace.com/us/en-us/women/bags/shoulder-bags/red-mini-icon-python-shoulder-bag-d6tot/DP3H581-D18PIV_DTU_UNICA_D6TOT__.html?cgid=142200,2020-04-05 19:43:18.894505,"$1,075",USD,one-size,us,"women,bags,shoulder-bags"
Gold Mini Icon Metallic Python Shoulder Bag,gold,"Crafted in luxurous python with a metallic finish, the iconic Versace bag is a timeless style. The shoulder bag has been revisited in a new,",https://www.versace.com/us/en-us/women/bags/shoulder-bags/gold-mini-icon-metallic-python-shoulder-bag-d86ot/DP3H581-D22PIV_DTU_UNICA_D86OT__.html?cgid=142200,2020-04-05 19:43:18.917610,"$1,075",USD,one-size,us,"women,bags,shoulder-bags"
Mini Icon Leather Shoulder Bag,black,"The iconic Versace bag, a timeless style crafted in supple calf leather has been revisited in a new, mini size. The shoulder bag features a",https://www.versace.com/us/en-us/women/bags/shoulder-bags/mini-icon-leather-shoulder-bag-k41ot/DP3H581-DV2T_DTU_UNICA_K41OT__.html?cgid=142200,2020-04-05 19:43:18.959611,$725,USD,one-size,us,"women,bags,shoulder-bags"
Chain Reaction Sneakers,"black,white,black,Burgundy,violet,white","The Chain Reaction, a sneaker that embodies the strongest elements of the Versace identity. Eclectic details create a one-of-a-kind shoe cha",https://www.versace.com/us/en-us/women/shoes/chain-reaction-sneakers/chain-reaction-sneakers-dbot/DSR705G-D7CTG_DBOT.html?cgid=100700,2020-04-05 19:43:18.985134,$995,USD,"35,35.5,36,36.5,37,37.5,38,38.5,39,39.5,40,40.5,41",us,"women,shoes,chain-reaction-sneakers"
Large Virtus Shoulder Bag,"white,black","The new large shoulder bag style features a belt shoulder strap, front flap turn lock closure and flat internal pockets. The supple leather",https://www.versace.com/us/en-us/women/bags/shoulder-bags/large-virtus-shoulder-bag-k41ot/DBFH489-D5VIT_DTU_UNICA_K41OT__.html?cgid=142200,2020-04-05 19:43:19.020057,"$2,350",USD,one-size,us,"women,bags,shoulder-bags"
Virtus Western Shoulder Bag,"yellow,print","Taking its name from the Roman deity that symbolizes strength, courage, and character, the Virtus shoulder bag is crafted in exceptional qua",https://www.versace.com/us/en-us/women/bags/shoulder-bags/virtus-western-shoulder-bag-konat/DBFG985-DVRBB_DTU_UNICA_KONAT__.html?cgid=142200,2020-04-05 19:43:19.050268,"$2,675",USD,one-size,us,"women,bags,shoulder-bags"
Virtus Western Shoulder Bag,"yellow,print","Taking its name from the Roman deity that symbolizes strength, courage, and character, the Virtus shoulder bag is crafted in exceptional qua",https://www.versace.com/us/en-us/women/bags/shoulder-bags/virtus-western-shoulder-bag-kmvgt/DBFG985-DVRBB_DTU_UNICA_KMVGT__.html?cgid=142200,2020-04-05 19:43:19.066580,"$2,675",USD,one-size,us,"women,bags,shoulder-bags"
Large Virtus Shoulder Bag,"white,black","The new large shoulder bag style features a belt shoulder strap, front flap turn lock closure and flat internal pockets. The supple leather",https://www.versace.com/us/en-us/women/bags/shoulder-bags/large-virtus-shoulder-bag-k0aot/DBFH489-D5VIT_DTU_UNICA_K0AOT__.html?cgid=142200,2020-04-05 19:43:19.111090,"$2,350",USD,one-size,us,"women,bags,shoulder-bags"
Virtus Small Handbag,"brown,black,pink","Debuting on the Fall-Winter 2019 runway, the Virtus bag takes its name from the Roman deity and symbolizes strength, courage, and character.",https://www.versace.com/us/en-us/women/bags/shoulder-bags/virtus-small-handbag-k41ot/DBFH211-D5VIT_DTU_UNICA_K41OT__.html?cgid=142200,2020-04-05 19:43:19.135921,"$1,425",USD,one-size,us,"women,bags,shoulder-bags"
Virtus Camera Bag,"white,black","Taking its name from the Roman deity that symbolizes strength, courage, and character, the new Virtus camera bag is crafted in exceptional q",https://www.versace.com/us/en-us/women/bags/shoulder-bags/virtus-camera-bag-k0aot/DBFH312-D5VIT_DTU_UNICA_K0AOT__.html?cgid=142200,2020-04-05 19:43:19.164027,"$1,225",USD,one-size,us,"women,bags,shoulder-bags"
Virtus Shoulder Bag,"red,brown,white,black,pink","Debuting on the Fall-Winter 2019 runway, the Virtus bag takes its name from the Roman deity and symbolizes strength, courage, and charact",https://www.versace.com/us/en-us/women/bags/shoulder-bags/virtus-shoulder-bag-k41ot/DBFG985-D5VIT_DTU_UNICA_K41OT__.html?cgid=142200,2020-04-05 19:43:19.194645,"$1,895",USD,one-size,us,"women,bags,shoulder-bags"
Virtus Evening Bag,"red,white,black,pink","Debuting on the Fall-Winter 2019 runway, the Virtus bag takes its name from the Roman deity and symbolizes strength, courage, and character.",https://www.versace.com/us/en-us/women/bags/shoulder-bags/virtus-evening-bag-k41ot/DBFH209-D5VIT_DTU_UNICA_K41OT__.html?cgid=142200,2020-04-05 19:43:19.240500,$795,USD,one-size,us,"women,bags,shoulder-bags"
Virtus Evening Bag,"red,white,black,pink","Debuting on the Fall-Winter 2019 runway, the Virtus bag takes its name from the Roman deity and symbolizes strength, courage, and character.",https://www.versace.com/us/en-us/women/bags/shoulder-bags/virtus-evening-bag-k0aot/DBFH209-D5VIT_DTU_UNICA_K0AOT__.html?cgid=142200,2020-04-05 19:43:19.258628,$795,USD,one-size,us,"women,bags,shoulder-bags"
Virtus Shoulder Bag,"red,brown,white,black,pink","Debuting on the Fall-Winter 2019 runway, the Virtus bag takes its name from the Roman deity and symbolizes strength, courage, and charact",https://www.versace.com/us/en-us/women/bags/shoulder-bags/virtus-shoulder-bag-k0aot/DBFG985-D5VIT_DTU_UNICA_K0AOT__.html?cgid=142200,2020-04-05 19:43:19.297495,"$1,895",USD,one-size,us,"women,bags,shoulder-bags"
Quilted Virtus Evening Bag,"blue,pink,black,orange,white,pink","Debuting on the Fall-Winter 2019 runway, the Virtus bag takes its name from the Roman deity and symbolizes strength, courage, and character.",https://www.versace.com/us/en-us/women/bags/shoulder-bags/quilted-virtus-evening-bag-k5bgt/DBFH209-DNATR4_DTU_UNICA_K5BGT__.html?cgid=142200,2020-04-05 19:43:19.334537,$895,USD,one-size,us,"women,bags,shoulder-bags"
Quilted Virtus Evening Bag,"blue,pink,black,orange,white,pink","Debuting on the Fall-Winter 2019 runway, the Virtus bag takes its name from the Roman deity and symbolizes strength, courage, and character.",https://www.versace.com/us/en-us/women/bags/shoulder-bags/quilted-virtus-evening-bag-k6bot/DBFH209-DNATR4_DTU_UNICA_K6BOT__.html?cgid=142200,2020-04-05 19:43:19.349878,$895,USD,one-size,us,"women,bags,shoulder-bags"
Quilted Virtus Shoulder Bag,"pink,white,orange,black,pink","Debuting on the Fall-Winter 2019 runway, the Virtus bag takes its name from the Roman deity and symbolizes strength, courage, and character.",https://www.versace.com/us/en-us/women/bags/shoulder-bags/quilted-virtus-shoulder-bag-k5bgt/DBFG985-DNATR4_DTU_UNICA_K5BGT__.html?cgid=142200,2020-04-05 19:43:19.365709,"$1,975",USD,one-size,us,"women,bags,shoulder-bags"
Quilted Virtus Shoulder Bag,"pink,white,orange,black,pink","Debuting on the Fall-Winter 2019 runway, the Virtus bag takes its name from the Roman deity and symbolizes strength, courage, and character.",https://www.versace.com/us/en-us/women/bags/shoulder-bags/quilted-virtus-shoulder-bag-k6bot/DBFG985-DNATR4_DTU_UNICA_K6BOT__.html?cgid=142200,2020-04-05 19:43:19.396067,"$1,975",USD,one-size,us,"women,bags,shoulder-bags"
Quilted Virtus Evening Bag,"blue,pink,black,orange,white,pink","Debuting on the Fall-Winter 2019 runway, the Virtus bag takes its name from the Roman deity and symbolizes strength, courage, and character.",https://www.versace.com/us/en-us/women/bags/shoulder-bags/quilted-virtus-evening-bag-k41ot/DBFH209-DNATR4_DTU_UNICA_K41OT__.html?cgid=142200,2020-04-05 19:43:19.432378,$895,USD,one-size,us,"women,bags,shoulder-bags"
Quilted Virtus Shoulder Bag,"pink,white,orange,black,pink","Debuting on the Fall-Winter 2019 runway, the Virtus bag takes its name from the Roman deity and symbolizes strength, courage, and character.",https://www.versace.com/us/en-us/women/bags/shoulder-bags/quilted-virtus-shoulder-bag-k41ot/DBFG985-DNATR4_DTU_UNICA_K41OT__.html?cgid=142200,2020-04-05 19:43:19.458643,"$1,975",USD,one-size,us,"women,bags,shoulder-bags"
Quilted Virtus Evening Bag,"blue,pink,black,orange,white,pink","Debuting on the Fall-Winter 2019 runway, the Virtus bag takes its name from the Roman deity and symbolizes strength, courage, and character.",https://www.versace.com/us/en-us/women/bags/shoulder-bags/quilted-virtus-evening-bag-k0aot/DBFH209-DNATR4_DTU_UNICA_K0AOT__.html?cgid=142200,2020-04-05 19:43:19.498119,$895,USD,one-size,us,"women,bags,shoulder-bags"
Barocco Patent Leather Pumps,"black,red","Crafted in patent leather, these pointed toe pumps boast the heritage Barocco print on the insole.",https://www.versace.com/us/en-us/women/shoes/pumps/barocco-patent-leather-pumps-d41oh/DST021P-DVE21_D41OH.html?cgid=131100,2020-04-05 19:43:19.531519,$625,USD,"35,36,37,37.5,38,38.5,39,39.5,40,41",us,"women,shoes,pumps"
Studded Leather Pumps,black,"Crafted in supple calf leather, these pointed toe, high heel, platform pumps are enriched with gold-tone studwork along the topline and the",https://www.versace.com/us/en-us/women/shoes/pumps/studded-leather-pumps-d41oh/DST205T-DVT4X_D41OH.html?cgid=131100,2020-04-05 19:43:19.567357,"$1,350",USD,"36,37,37.5,38,38.5,39,40,41",us,"women,shoes,pumps"
Barocco Patent Leather Pumps,"black,red","Crafted in patent leather, these pointed toe pumps boast the heritage Barocco print on the insole.",https://www.versace.com/us/en-us/women/shoes/pumps/barocco-patent-leather-pumps-k6noh/DST021P-DVE21_K6NOH.html?cgid=131100,2020-04-05 19:43:19.593145,$625,USD,"36,37,37.5,38,38.5,39,40,41",us,"women,shoes,pumps"
Platform Palazzo Pumps,red,"High heel, pointed toe pumps with a platform crafted from patent calf leather. Feature a tonal three dimensional gold tone Medusa embellishm",https://www.versace.com/us/en-us/women/shoes/pumps/platform-palazzo-pumps-kt4oh/DSR384S-D2VCE_KT4OH.html?cgid=131100,2020-04-05 19:43:19.617360,$995,USD,"36,37,37.5,38,40,41",us,"women,shoes,pumps"
Palazzo Platform Pumps,black,"Crafted from supple calf leather, these platform pumps are enriched with a three-dimensional Medusa plaque on the pointed toes. The pumps ar",https://www.versace.com/us/en-us/women/shoes/pumps/palazzo-platform-pumps-dnarh/DSR384S-DVS8_DNARH.html?cgid=131100,2020-04-05 19:43:19.658879,"$1,475",USD,"36,37,37.5,38,38.5,39,40,41",us,"women,shoes,pumps"
Medusa Western Cage Pumps,black,"Drawing from the House's rich heritage, these leather cage pumps are embellished with western-inspired hardware: transforming the emblematic",https://www.versace.com/us/en-us/women/shoes/pumps/medusa-western-cage-pumps-d41oh/DST156P-DVT4X_D41OH.html?cgid=131100,2020-04-05 19:43:19.674145,"$1,925",USD,"36,37,37.5,38,38.5,39,40,41",us,"women,shoes,pumps"
V-Bow Cage Pumps,black,"These heritage cage pumps are crafted from soft satin and embellished with crystal-enriched accents, including bows and Medusa medallions.",https://www.versace.com/us/en-us/women/shoes/pumps/v-bow-cage-pumps-d41oh/DST062P-DRA6_D41OH.html?cgid=131100,2020-04-05 19:43:19.691555,"$2,475",USD,"36,37,37.5,38,38.5,39,40,41",us,"women,shoes,pumps"
Virtus Platform Pumps,black,"Crafted in the softest calf leather, these pointed toe, platform pumps are enriched with Virtus V hardware on the toes.",https://www.versace.com/us/en-us/women/shoes/pumps/virtus-platform-pumps-d41oh/DST177S-DVT2P_D41OH.html?cgid=131100,2020-04-05 19:43:19.725942,"$1,125",USD,"35,36,36.5,37,37.5,38,38.5,39,39.5,40,41",us,"women,shoes,pumps"
Barocco Print Palazzo Pumps,print,"Crafted from supple calf leather in the Barocco print, these pointed-toe pumps are embellished with a three-dimensional Medusa plaque on the",https://www.versace.com/us/en-us/women/shoes/pumps/barocco-print-palazzo-pumps-d4doh/DSL936P-DVB9_D4DOH.html?cgid=131100,2020-04-05 19:43:19.760772,$995,USD,"36,36.5,37,37.5,38,38.5,39,39.5,40,41",us,"women,shoes,pumps"
Transparent Heel Pumps,"black,white","Classic, with a twist - these patent leather pumps are embellished with a clear, plexi heel seen on the runway.",https://www.versace.com/us/en-us/women/shoes/pumps/transparent-heel-pumps-d41/DST312P-D2VE_D41.html?cgid=131100,2020-04-05 19:43:19.819434,"$1,125",USD,"36,36.5,37,38,38.5,39,40",us,"women,shoes,pumps"
Transparent Heel Pumps,"black,white","Classic, with a twist - these patent leather pumps are embellished with a clear, plexi heel seen on the runway.",https://www.versace.com/us/en-us/women/shoes/pumps/transparent-heel-pumps-k0a/DST312P-D2VE_K0A.html?cgid=131100,2020-04-05 19:43:19.836441,"$1,125",USD,"36,37,38,38.5,39,40",us,"women,shoes,pumps"
Barocco Pumps,"black,white,red","Crafted from supple calf leather, these pointed toe, patent leather pumps feature the heritage Barocco print.",https://www.versace.com/us/en-us/women/shoes/pumps/barocco-pumps-k0aoh/DST037M-DVE21_K0AOH.html?cgid=131100,2020-04-05 19:43:19.888062,$625,USD,"36,36.5,39,39.5,40",us,"women,shoes,pumps"
Barocco Pumps,"black,white,red","Crafted from supple calf leather, these pointed toe, patent leather pumps feature the heritage Barocco print.",https://www.versace.com/us/en-us/women/shoes/pumps/barocco-pumps-k6noh/DST037M-DVE21_K6NOH.html?cgid=131100,2020-04-05 19:43:19.921619,$625,USD,"36,37,37.5,38,38.5,39,40,41",us,"women,shoes,pumps"
Virtus Pumps,Gold,"Crafted from exceptionally supple calf leather, these pointed toe pumps are enriched with emblematic Virtus V hardware at the heel.",https://www.versace.com/us/en-us/women/shoes/pumps/virtus-pumps-d41op/DST206P-DVT2P_D41OP.html?cgid=131100,2020-04-05 19:43:19.937357,"$1,125",USD,"36,37,37.5,38,38.5,39,40,41",us,"women,shoes,pumps"
Barocco Pumps,"black,white,red","Crafted from supple calf leather, these pointed toe, patent leather pumps feature the heritage Barocco print.",https://www.versace.com/us/en-us/women/shoes/pumps/barocco-pumps-d41oh/DST037M-DVE21_D41OH.html?cgid=131100,2020-04-05 19:43:19.995476,$625,USD,"36,37,37.5,38,38.5,39,40,41",us,"women,shoes,pumps"
Tie-Dye Pumps,pink,"Seen on the runway, these pointed toe pumps boast the Tie-Dye print. The signature style is enriched with a clear, plexi heel.",https://www.versace.com/us/en-us/women/shoes/pumps/tie-dye-pumps-dbf/DST312P-DV23_DBF.html?cgid=131100,2020-04-05 19:43:20.009348,"$1,225",USD,"36,37,38,38.5,39,40",us,"women,shoes,pumps"
V-Bow Pumps,black,These elegant satin pumps are enriched with a crystal-embellished bow accent on the pointed toe.,https://www.versace.com/us/en-us/women/shoes/pumps/v-bow-pumps-d41oh/DST093P-DRA6_D41OH.html?cgid=131100,2020-04-05 19:43:20.033953,"$1,075",USD,"36,37,37.5,38,38.5,39,40",us,"women,shoes,pumps"
Safety Pin Mid-Heel Patent Pumps,pink,"This versatile style transitions seamlessly from the office to happy hour - crafted from patent leather, these pointed toe pumps feature a c",https://www.versace.com/us/en-us/women/shoes/pumps/safety-pin-mid-heel-patent-pumps-k6toh/DST208H-D2VE_K6TOH.html?cgid=131100,2020-04-05 19:43:20.063166,$895,USD,"36,37,37.5,38,38.5,39,40,41",us,"women,shoes,pumps"
Safety Pin Patent Pumps,black,"These versatile pumps can be worn with evening looks or as an accent piece in casual outfits. Crafted from patent leather, these pointed toe",https://www.versace.com/us/en-us/women/shoes/pumps/safety-pin-patent-pumps-d41oh/DST207P-D2VE_D41OH.html?cgid=131100,2020-04-05 19:43:20.075956,$895,USD,"36,36.5,37,37.5,38,38.5,39,39.5,40,41",us,"women,shoes,pumps"
Barocco Signature Print Silk Shirt Dress,print,"This elegant day dress is crafted from pure silk twill in the Barocco Signature print, featuring an all-over motif of Gianni Versace's handw",https://www.versace.com/us/en-us/women/clothing/dresses/barocco-signature-print-silk-shirt-dress-a7001/A82301-A233248_A7001.html?cgid=120100,2020-04-05 19:43:20.092855,"$1,825",USD,"38,40,42,44,46",us,"women,clothing,dresses"
V Barocco Print Silk Dress,print,"Crafted in pure silk twill, the shoulder and sleeve silhouette of this dress are inspired by twisting and turning bandana scarves.The dress",https://www.versace.com/us/en-us/women/clothing/dresses/v-barocco-print-silk-dress-a7001/A85786-A233248_A7001.html?cgid=120100,2020-04-05 19:43:20.107908,"$1,925",USD,"40,42,46",us,"women,clothing,dresses"
V Barocco Print Asymmetric Silk Dress,print,"Inspired by twisting, turning, draping and tying foulards, this dress boasts an asymmetric silhouette accentuated by a gold-tone Greca shoul",https://www.versace.com/us/en-us/women/clothing/dresses/v-barocco-print-asymmetric-silk-dress-a7001/A85792-A233248_A7001.html?cgid=120100,2020-04-05 19:43:20.141971,"$2,825",USD,"40,42,46",us,"women,clothing,dresses"
Barocco Signature Shift Dress,print,"This crew neck, sleeveless day dress is crafted from pure silk twill in the Barocco Signature print - depicting an all-over motif of Gianni",https://www.versace.com/us/en-us/women/clothing/dresses/barocco-signature-shift-dress-a7900/A85342-A232981_A7900.html?cgid=120100,2020-04-05 19:43:20.167959,"$1,675",USD,"38,40,42,44,46",us,"women,clothing,dresses"
Barocco Rodeo Print Sleeveless Shirt Dress,print,"Crafted in soft viscose jersey, this sleeveless shirt dress boasts the Barocco Rodeo print, in which a central Baroque V is surrounded by we",https://www.versace.com/us/en-us/women/clothing/dresses/barocco-rodeo-print-sleeveless-shirt-dress-a7001/A85661-A233251_A7001.html?cgid=120100,2020-04-05 19:43:20.290447,"$1,450",USD,"38,40,42",us,"women,clothing,dresses"
Medusa Medallion Dress,black,"A classic style, this little black dress is enriched with heritage Medusa Medallions on the shoulder straps. The dress features V Barocco pr",https://www.versace.com/us/en-us/women/clothing/dresses/medusa-medallion-dress-a1008/A85421-A233374_A1008.html?cgid=120100,2020-04-05 19:43:20.326818,"$1,450",USD,"42,46",us,"women,clothing,dresses"
Barocco Rodeo Print Shirt Dress,print,"A daywear staple, this viscose jersey shirt dress boasts the Barocco Rodeo print, depicting a Baroque letter V surrounded by western motifs.",https://www.versace.com/us/en-us/women/clothing/dresses/barocco-rodeo-print-shirt-dress-a7606/A85374-A233266_A7606.html?cgid=120100,2020-04-05 19:43:20.350457,"$1,675",USD,"38,40,42,44",us,"women,clothing,dresses"
Medusa Safety Pin Mini Dress,black,Fit and flare dress crafted in envers satin and embellished with a lateral leg split enriched with Medusa Safety Pin hardware-,https://www.versace.com/us/en-us/women/clothing/dresses/medusa-safety-pin-mini-dress-a1008/A83377-A224536_A1008.html?cgid=120100,2020-04-05 19:43:20.364244,"$1,250",USD,"36,38,40,42",us,"women,clothing,dresses"
Tie-Dye Silk Dress,Green/Black,"Crafted from pure silk, this ribbed knit dress features a tie-dye pattern inspired by colors of the desert flora. The dress is enriched with",https://www.versace.com/us/en-us/women/clothing/dresses/tie-dye-silk-dress-a2036/A85603-A233119_A2036.html?cgid=120100,2020-04-05 19:43:20.385202,"$1,595",USD,"36,38,40,42,44",us,"women,clothing,dresses"
Studded Tweed Dress,print,"Crafted from tweed, this sleeveless dress is enriched with applique heritage leather pockets featuring detailed studwork.",https://www.versace.com/us/en-us/women/clothing/dresses/studded-tweed-dress-a8324/A85652-A232509_A8324.html?cgid=120100,2020-04-05 19:43:20.402691,"$2,450",USD,"38,40,42,46",us,"women,clothing,dresses"
V-Pattern Lace Dress,black,"This seamless, form-fitting dress is crafted from Barocco V-patterned lace.",https://www.versace.com/us/en-us/women/clothing/dresses/v-pattern-lace-dress-a1008/A85538-A233113_A1008.html?cgid=120100,2020-04-05 19:43:20.420435,$925,USD,"36,38,40,42,44,46,48",us,"women,clothing,dresses"
Safety Pin Dress,black,"This dress transitions seemlessly from the office to happy hour with a loose fit, crew neck and short sleeves. The envers satin dress featu",https://www.versace.com/us/en-us/women/clothing/dresses/safety-pin-dress-a1008/A85784-A224249_A1008.html?cgid=120100,2020-04-05 19:43:20.445710,"$1,225",USD,"38,40,42,46",us,"women,clothing,dresses"
Nappa Leather Mini Dress,black,"This sleeveless, slim fit dress is crafted from soft nappa leather and boasts a cut-out element on the shoulder enriched with pin-clip hardw",https://www.versace.com/us/en-us/women/clothing/dresses/nappa-leather-mini-dress-a1008/A83351-A227281_A1008.html?cgid=120100,2020-04-05 19:43:20.550411,"$3,395",USD,"38,40,42",us,"women,clothing,dresses"
Medusa Accent Dress,black,"Crafted in a jersey blend fabric, this crew neck, sleeveless dress is a wardrobe staple - the little black dress is enriched with Medusa har",https://www.versace.com/us/en-us/women/clothing/dresses/medusa-accent-dress-a1008/A84790-A216694_A1008.html?cgid=120100,2020-04-05 19:43:20.584756,"$1,450",USD,"38,40,42",us,"women,clothing,dresses"
Pop Animalier Print Mini Dress,animalier,"A runway style, this mini dress boasts the Pop Animalier print in a metallic hue. The shape of the statement, sculptural sleeves is inspired",https://www.versace.com/us/en-us/women/clothing/dresses/pop-animalier-print-mini-dress-a7804/A86266-A233840_A7804.html?cgid=120100,2020-04-05 19:43:20.599785,"$2,825",USD,36,us,"women,clothing,dresses"
Sculptural Shoulder Cut-Out Dress,black,"A contemporary take on a black evening dress, this viscose crêpe jersey model is defined by a strong shoulder silhouette and draped sleeves.",https://www.versace.com/us/en-us/women/clothing/dresses/sculptural-shoulder-cut-out-dress-a1008/A86560-A208595_A1008.html?cgid=120100,2020-04-05 19:43:20.615497,"$1,725",USD,"36,38,40,42,44",us,"women,clothing,dresses"
Jungle Print Dress,print,"An iconic piece of fashion history, this silk muslin evening dress was famously reprised on the Spring-Summer 2020 runway. The design celebr",https://www.versace.com/us/en-us/women/clothing/dresses/jungle-print-dress-a7488/A86651-A234695_A7488.html?cgid=120100,2020-04-05 19:43:20.639300,"$6,825",USD,"36,38,40,42",us,"women,clothing,dresses"
Medusa Accent Knit Dress,black,Ribbed knit dress with an accent neckline - the long sleeved dressed features visible shoulder strap accents enrcihed with Medusa hardware.,https://www.versace.com/us/en-us/women/clothing/dresses/medusa-accent-knit-dress-a1008/A85521-A233112_A1008.html?cgid=120100,2020-04-05 19:43:20.664839,$925,USD,"36,38,40,42,44,46,48",us,"women,clothing,dresses"
Iconic Neckline Strapless Dress,black,"Seen on the Spring-Summer 2020 runway, this neoprene midi dress features a strapless bustier boasting a deep heritage neckline. Style the dr",https://www.versace.com/us/en-us/women/clothing/dresses/iconic-neckline-strapless-dress-a1008/A86477-A234369_A1008.html?cgid=120100,2020-04-05 19:43:20.689860,"$1,825",USD,"38,40,42,44",us,"women,clothing,dresses"
